id,name,reagirovanie
51,"Ненадёжная защита данных при взаимодействии с внешними подрядчиками","Убедиться в наличии всех необходимых соглашений с подрядчиками по защите данных. Применить шифрование и механизмы защиты данных при передаче их третьим сторонам. Применить строгие политики для доступа внешних подрядчиков к данным."
52,"Необоснованный доступ подрядчиков к критичным системам","Проверить учетные записи и доступы подрядчиков к критическим системам. Ограничить доступ к системам, предоставив минимально необходимые привилегии. Регулярно пересматривать права доступа подрядчиков."
53,"Использование несоответствующих стандартам систем и решений","Провести аудит всех используемых систем и решений на соответствие международным стандартам безопасности. Применить обновления или заменить системы, не соответствующие требованиям. Внедрить стандарты безопасности на всех уровнях организации."
54,"Проблемы с контролем доступа к API","Пересмотреть и укрепить механизмы аутентификации и авторизации для всех API. Настроить контроль доступа с использованием API-ключей и токенов. Внедрить системы мониторинга для отслеживания попыток несанкционированного доступа к API."
55,"Подделка или манипуляция данными на сервере","Провести аудит целостности данных на сервере и обеспечить использование механизмов контроля версий и проверки целостности. Внедрить регулярные проверки для выявления манипуляций с данными. Установить систему оповещений о подозрительных изменениях данных."
56,"Отсутствие или слабая защита в виртуализированных средах","Провести оценку безопасности виртуализированных сред и применить дополнительные механизмы защиты. Убедиться в наличии всех необходимых обновлений безопасности для гипервизоров и виртуальных машин. Внедрить защиту на уровне сети и доступа."
57,"Утечка данных через ошибочно настроенные сетевые устройства","Провести аудит всех сетевых устройств на правильность настроек безопасности. Пересмотреть и усилить настройки безопасности, особенно для устройств с доступом к критичным данным. Внедрить систему мониторинга для обнаружения утечек через ошибочные настройки."
58,"Неадекватное шифрование конфиденциальных данных","Пересмотреть и усилить политику шифрования данных. Убедиться в использовании современных и надежных алгоритмов шифрования для всех конфиденциальных данных. Провести тестирование систем на уязвимости, связанные с шифрованием."
59,"Нарушение целостности данных через ошибочные системы резервного копирования","Провести аудит систем резервного копирования и проверку на целостность данных. Обновить механизмы резервного копирования и обеспечить регулярное тестирование восстановления данных. Внедрить проверки целостности данных при восстановлении."
60,"Отсутствие защиты на уровне BIOS/UEFI","Установить пароль на BIOS/UEFI для защиты от несанкционированного доступа. Включить функции защиты от загрузки с неавторизованных носителей. Обновить прошивку BIOS/UEFI до последних версий, обеспечивающих максимальную безопасность."
61,"Проблемы с физическим доступом в серверные комнаты","Обеспечить контроль доступа в серверные помещения с помощью систем видеонаблюдения, карт доступа и других механизмов. Провести регулярные проверки на соответствие стандартам безопасности. Обучить персонал мерам защиты от несанкционированного доступа."
62,"Невозможность восстановить данные из резервных копий","Провести тестирование всех резервных копий на возможность восстановления данных. Обновить процедуры восстановления данных и обеспечить наличие дополнительных копий. Внедрить регулярные проверки и мониторинг целостности данных в резервных копиях."
63,"Физическая кража устройств с конфиденциальной информацией","Провести расследование инцидента и выяснить, какие данные были украдены. Обновить все пароли и доступы, связанные с устройством. Применить меры для шифрования данных на всех мобильных устройствах и использовать системы для отслеживания украденных устройств."
64,"Нарушение политики безопасности на уровне поставщиков оборудования","Провести расследование инцидента с поставщиком оборудования. Оценить риски, связанные с текущими поставщиками, и обновить условия контрактов. Внедрить регулярные проверки и аудиты безопасности у поставщиков."
65,"Использование ненадежных сертификатов и протоколов SSL/TLS","Провести аудит всех используемых сертификатов и протоколов SSL/TLS на предмет их надежности. Заменить устаревшие или ненадежные сертификаты и протоколы на более безопасные версии. Убедиться в правильной настройке серверов для использования безопасных протоколов."
66,"Подделка или утечка сертификатов безопасности","Провести расследование инцидента, связанного с утечкой или подделкой сертификатов. Применить меры для отмены всех скомпрометированных сертификатов. Внедрить дополнительные системы мониторинга для раннего обнаружения подобных инцидентов."
67,"Атаки на систему связи через VoIP","Провести проверку системы VoIP на наличие уязвимостей. Обновить программное обеспечение и применить системы защиты от атак, таких как отказ в обслуживании (DoS) и подслушивание. Включить шифрование для всех голосовых вызовов."
68,"Мошенничество с использованием телефонных звонков","Провести расследование инцидента и проанализировать логи звонков. Уведомить сотрудников о рисках мошенничества и обучить их мерам защиты. Внедрить фильтрацию звонков и блокировку подозрительных номеров."
69,"Атаки через приложения и устройства интернета вещей (IoT)","Провести аудит всех IoT-устройств в сети и применить обновления безопасности. Ограничить доступ к критичным системам для IoT-устройств и установить системы мониторинга для их защиты. Применить шифрование для передаваемых данных."
70,"Нарушение защиты данных через неправильное управление базами данных","Провести аудит всех баз данных и применить меры для защиты данных, включая шифрование. Проверить настройки прав доступа и минимизировать их в соответствии с политиками безопасности. Внедрить систему мониторинга для отслеживания подозрительных действий с данными."
71,"Вредоносное использование данных через публичные компьютеры","Обучить сотрудников и пользователей о рисках использования публичных компьютеров для доступа к конфиденциальной информации. Внедрить систему защиты при использовании публичных устройств, включая виртуальные частные сети (VPN) и двухфакторную аутентификацию."
72,"Несоответствие системы безопасности международным стандартам","Провести аудит системы безопасности на соответствие международным стандартам (например, ISO 27001, NIST). Обновить процедуры и политику безопасности в соответствии с актуальными требованиями. Внедрить процесс сертификации и регулярных проверок соответствия."
73,"Сбор и распространение данных без согласия пользователя","Провести расследование инцидента и идентифицировать, какие данные были собраны без согласия. Обновить политику конфиденциальности и процедуры сбора данных, обеспечив их соответствие законодательству о защите персональных данных. Извлечь и удалить все незаконно собранные данные."
74,"Использование уязвимостей в мобильных приложениях","Произвести аудит всех мобильных приложений, установленных в организации, на наличие уязвимостей. Применить обновления безопасности и провести тестирование на проникновение. Обновить политику безопасности для использования мобильных приложений в компании."
75,"Атаки через социальные инженерии (телефонные звонки, SMS)","Обучить сотрудников методам распознавания атак социальной инженерии. Установить системы фильтрации и блокировки подозрительных звонков и сообщений. Внедрить многофакторную аутентификацию для доступа к важным системам."
76,"Нарушение интеллектуальной собственности","Провести расследование инцидента и выявить утечку интеллектуальной собственности. Обновить меры защиты на уровне технологий, включая шифрование и контроль доступа. Уведомить соответствующие органы и провести юридическую экспертизу."
77,"Отсутствие контрольных механизмов за активностью на рабочих местах","Внедрить системы мониторинга активности сотрудников на рабочих местах. Обеспечить соответствие политик безопасности, включая контроль за доступом к чувствительной информации и мониторинг действий пользователей. Обучить сотрудников безопасному поведению."
78,"Утечка информации через службы поддержки пользователей","Провести расследование инцидента и выявить источник утечки данных. Обновить процедуры обращения с клиентскими данными в службах поддержки. Внедрить системы контроля и мониторинга общения с клиентами, включая ограничение доступа к чувствительным данным."
79,"Ошибка в конфиденциальности при обмене информацией с партнёрами","Провести аудит всех обменов данными с партнерами и оценить их безопасность. Обновить соглашения с партнерами по защите данных и применить дополнительные меры для их безопасности. Внедрить систему мониторинга для обмена данными с третьими сторонами."
80,"Превышение полномочий в облачных сервисах","Проверить все облачные учетные записи и ограничить доступ в соответствии с принципом минимальных привилегий. Пересмотреть права доступа сотрудников и настроить уведомления о попытках использования привилегий для выполнения несанкционированных действий."
81,"Невозможность обнаружения и остановки инцидентов в реальном времени","Внедрить систему мониторинга безопасности, которая позволяет обнаруживать инциденты в реальном времени. Использовать средства автоматической реакции и оповещения для немедленного реагирования на угрозы. Обучить команду по реагированию на инциденты для более быстрой ликвидации угроз."
82,"Ненадежная защита данных в транзите","Использовать зашифрованные каналы связи для защиты данных в процессе передачи. Настроить систему мониторинга и защиты для всех передаваемых данных, включая использование SSL/TLS для веб-трафика и VPN для внутренних сетей. Убедиться в правильности конфигурации протоколов шифрования."
83,"Использование пиратских или несанкционированных копий ПО","Провести аудит всех установленных программных продуктов и удалить нелицензионное ПО. Обновить политику закупки программного обеспечения и обеспечить использование только лицензионных версий. Уведомить сотрудников о рисках использования пиратского ПО."
84,"Превышение доступа к данным через сторонние устройства","Проверить все устройства, подключенные к корпоративной сети, на наличие несанкционированных приложений и данных. Ограничить доступ сторонним устройствам к корпоративным системам через систему управления мобильными устройствами (MDM)."
85,"Проблемы с прозрачностью и отчетностью по вопросам безопасности","Провести анализ и обновить процессы отчетности по безопасности, обеспечив их прозрачность. Внедрить системы для регулярной проверки и аудита всех инцидентов и мер по безопасности. Обеспечить отчетность для всех заинтересованных сторон."
86,"Необоснованное развертывание служб или сервисов без анализа рисков","Провести анализ рисков перед развертыванием новых сервисов или приложений. Убедиться в наличии соответствующих мер безопасности и тестирования перед внедрением. Обновить политику по развертыванию и использованию новых сервисов в организации."
87,"Использование плохих практик при реализации безопасности приложений","Пересмотреть и обновить процессы разработки, включив в них лучшие практики безопасного кодирования. Провести обучение разработчиков по вопросам безопасности и внедрить регулярные проверки на безопасность кода."
88,"Отсутствие контроля за мобильными устройствами сотрудников (BYOD)","Внедрить политику BYOD с контролем за мобильными устройствами сотрудников. Настроить систему управления мобильными устройствами (MDM) для контроля доступа и безопасности. Обучить сотрудников мерам защиты при использовании личных устройств в рабочей среде."
89,"Неэффективное управление жизненным циклом данных","Пересмотреть политику управления данными, включая этапы сбора, хранения и удаления данных. Внедрить процедуры для правильного удаления устаревших или ненужных данных. Использовать системы для мониторинга и управления жизненным циклом данных."
90,"Злоупотребление корпоративными ресурсами сотрудниками","Провести аудит использования корпоративных ресурсов и выявить злоупотребления. Обновить внутренние политики использования ресурсов и внедрить мониторинг для предотвращения несанкционированного использования. Применить санкции в случае нарушений."
91,"Отсутствие мониторинга системы безопасности в реальном времени","Внедрить систему мониторинга безопасности, которая обеспечивает обнаружение инцидентов в реальном времени. Обучить сотрудников реагировать на сигналы тревоги и немедленно принимать меры по защите от угроз."
92,"Неэффективное реагирование на угрозы через внешний периметр","Обновить процессы реагирования на угрозы, связанные с внешними периметрами. Внедрить системы защиты от внешних атак, такие как межсетевые экраны, IDS/IPS и системы защиты от DDoS-атак. Провести тренировки для команды реагирования на инциденты."
93,"Недостаточные меры для защиты персональных данных","Провести аудит всех процессов обработки персональных данных и обновить меры защиты. Внедрить систему шифрования для хранения и передачи персональных данных. Убедиться в соблюдении законов о защите персональных данных (GDPR, CCPA)."
94,"Скачивание неавторизованных приложений, установленных на устройствах","Провести аудит всех устройств сотрудников и удалить несанкционированные приложения. Внедрить системы контроля за установкой приложений, включая мобильные устройства. Обучить сотрудников мерам безопасности и рискам установки неофициальных приложений."
95,"Использование поддельных и фальшивых электронных документов","Провести расследование инцидента и выявить источник фальсификации документов. Применить системы для верификации подлинности документов, включая цифровые подписи и блокчейн-технологии. Обучить сотрудников правилам работы с электронными документами."
96,"Использование старых и незащищённых протоколов связи","Провести аудит всех используемых протоколов связи и обновить их до безопасных версий. Отключить устаревшие и уязвимые протоколы, такие как SSL 2.0/3.0 и TLS 1.0. Обучить сотрудников по вопросам безопасности сетевых протоколов."
